{
  "schema": "twrmc/camera-calibration",
  "version": 1,
  "calibrationId": "calibration-1",
  "cameraId": "camera-1",
  "imageWidth": 800,
  "imageHeight": 600,
  "intrinsicMatrix": [700, 0, 400, 0, 700, 300, 0, 0, 1],
  "distortionCoefficients": [0.01, -0.02, 0, 0, 0],
  "worldFromCameraMatrix": [1, 0, 0, -1, 0, 1, 0, -2, 0, 0, 1, -3, 0, 0, 0, 1],
  "worldUnit": "meter",
  "calibratedAt": "2026-09-13T12:00:00.000Z"
}
